{
  "run_id": "00000000-0000-4000-8000-000000000001",
  "source_type": "sqlserver",
  "foreign_catalog": "sqlserver_fed",
  "uc_catalog": "edw_migration",
  "source_database": "sourcedb",
  "scoped_tables": [
    "dbo_customer",
    "dbo_city",
    "dbo_item",
    "dbo_sale"
  ],
  "databricks_host": "https://dbc-example.cloud.databricks.com",
  "max_retries": 2,
  "attempt": 0,
  "demo_mode": true,
  "track_a": true,
  "routines_skipped_reason": null
}
